Name,for,deadline,link
The Publicity.ai SEO & Content Marketing Scholarship,Bachelor,15 December 2017,https://publicity.ai/?scholarship
Realtime CV Annual Scholarship Program,"Bachelor, Master",15 September 2017,https://www.realtimecv.com/scholarships/realtime-cv-annual-scholarship-program
Luigi Einaudi Foundation scholarships,"Master, Phd",28 April 2017,http://www.fondazioneeinaudi.it/en/scholarships/
iVisa Scholarship,"Bachelor, Master, Phd, Course",20 May 2017,https://www.ivisa.com/visa-blog/scholarship
UCI Online International Master in Project Management,Master,4 September 2017,
KILROY Foundation Grants,"Bachelor, Master, Phd, Course",10 July 2017,http://www.kilroyfoundation.net/grants/
The Lead Roster B2B Sales & Marketing Scholarship,Bachelor,15 December 2017,https://www.leadroster.com/?scholarship
Pitch your Idea! Win a Scholarship!,"Bachelor, Master, Phd",4 September 2017,http://scholarshipfellow.com/pitch-your-idea-win-a-scholarship/
A-1 Auto Transport Scholarship,"Bachelor, Master, Phd, Course",10 March 2018,https://www.a1autotransport.com/a-1-auto-transport-scholarship/
Internet Marketing Scholarship 2017,"Bachelor, Master, Phd, Course",30 July 2017,http://instaboostgram.com/scholarship/
First in Family,"Bachelor, Master, Phd",31 December 2017,https://studysoup.com/scholarships/first-in-family
iMoneySlots Online Marketing Scholarship,Bachelor,31 December 2017,http://imoneyslots.com/imoneyslots-online-marketing-scholarship.html
Filmora Scholarship Program 2017,"Bachelor, Master, Phd, Course",31 August 2017,
Don’t Text and Drive Scholarship,Bachelor,1 December 2017,https://www.knrlegal.com/knr-dont-text-drive-scholarship-2017/
Academic Writing Scholarship,"Bachelor, Course",3 October 2017,
Marine Stewardship Council Scholarship Research Program,Master,3 April 2017,https://www.msc.org/global-impacts/msc-scholarship-program
MaleSense Pro Internet Marketing Scholarship,Bachelor,30 April 2017,https://www.malesensepro.com/scholarship/
Science and Engineering Research Board Overseas Postdoctoral Fellowship,Phd,,http://www.serb.gov.in/post-whatsnew.php
Pasteur Institute Doctoral Research Scholarship for French and Foreign Scientists,Phd,,https://www.pasteur.fr/en/education/our-programs-and-courses/doctoral-and-post-doctoral-programs/institut-pasteur-international-network-doctoral-program
"100 Government of India Undergraduate Scholarships for Sri Lankan Students, 2017-2018",Bachelor,,
Meri Pehchaan Scholarship Program,Bachelor,30 April 2017,http://timesandtrendsacademy.com/meri-pehchaan-scholarship-times-trends-academy/
Leakey Foundation Fellowships in paleoanthropology and primatology,"Bachelor, Master",1 March 2017,https://leakeyfoundation.org/grants/baldwins/
Western Union Foundation Global Scholarship Program,Bachelor,12 April 2017,https://foundation.westernunion.com/wuscholars/index.html
OLM Malala Yousafzai Scholarship,"Bachelor, Master, Course",1 December 2017,http://www.onlinelogomaker.com/scholarships-for-women
International Women in Media Scholarship,"Bachelor, Master, Phd",1 July 2017,https://www.everipedia.com/2017-international-women-in-media-scholarship/
ICUB Fellowship for Young Researchers,Course,31 December 2018,http://icub.unibuc.ro/
Kurita Water and Environment Foundation Scholarships,Master,21 April 2017,http://www.ait.ac.th/admissions/Current_Scholarships/kurita-scholarships-for-august-2017-intake/#.WNTKC57-u01
"2017 Global Excellence PhD Scholarships for Armenian Students, Abroad",Phd,,https://gulbenkian.pt/en/grant/global-excellence-scholarship/
"25 AXA Research Fund Fellowships for International Students, 2017",Phd,,https://www.axa-research.org/en/page/post-doctoral-fellowships
"ICS-HYI Doctoral Fellowship for Indian Students in China Studies, 2017",Phd,,http://www.icsin.org/ics-hyi-fellowship-for-china-studies-call-for-applications/
"PhD Fellowship Programme in Engineering to Study Abroad, 2017",Phd,,http://www.robertorocca.org/en/fellowships.aspx
Ritchie-Jennings Memorial Scholarship Program - ACFE Foundation,"Bachelor, Master",27 January 2017,http://www.acfe.com/scholarship.aspx
Singapore Airlines Open Scholarship,"Bachelor, Master",NaN undefined NaN,http://www.singaporeair.com/jsp/cms/en_UK/global_footer/scholarships.jsp
Society of Petroleum Engineers (SPE) - The Gus Archie Memorial Scholarship (merit based),Bachelor,15 April 2017,
Slawson Awards - Royal Geographical Society,Phd,NaN undefined NaN,
IPRA Foundation Peace Research Grants Program,Phd,NaN undefined NaN,http://iprafoundation.org/peace-research-grants/
General Scholarship Scheme (GSS) - Indian Council For Cultural Relations (ICCR),"Bachelor, Master, Phd",NaN undefined NaN,
WCC scholarships programme (World Council of Churches),"Bachelor, Master, Phd",NaN undefined NaN,http://www.wcc-coe.org/wcc/what/education/scholarships-leaflet-e.pdf
Pfizer Worldwide Research and Development Postdoctoral Program,Phd,NaN undefined NaN,
 iPrice Innovators Grant 2017,"Bachelor, Master, Phd, Course",31 August 2017,https://iprice.sg/blog/iprice-innovators-grant-2017/
Bali Scholarship,"Bachelor, Master",5 December 2017,http://www.balistudies.org/scholarship.html
"EM INTACT Scholarship Programme for Regional Asia and European Union, 2017","Bachelor, Master, Phd",,http://www.em-intact.eu/
"General Scholarship Scheme (GSS) for Foreign Students in India, 2017-2018","Bachelor, Master, Phd",,http://iccr.gov.in/sites/default/files/Applicationform.pdf
"Tata Housing Scholarships for Meritorious Girl Students in India, 2017","Bachelor, Master",,http://tatahousing.in/csr/about_srijan.php
"Government of India PhD Scholarships in Mathematics, 2017",Phd,,http://www.nbhm.dae.gov.in/sites/default/files/PhD%20Ad%202017-18.pdf
ERASMUS+ Programme,"Master, Phd",NaN undefined NaN,
Luftia Rabbani Foundation - Travel scholarship,Phd,NaN undefined NaN,
Institute for Current World Affairs - FELLOWSHIPS,Phd,NaN undefined NaN,https://icwa.wpengine.com/apply/
Anita Borg Systers - Pass-It-On (PIO) Awards,Phd,22 March 2017,http://anitaborg.org/awards-grants/pass-it-on-awards-program/
John Dillon Fellowship - Australian Centre for International Agricultural Research (ACIAR),Phd,NaN undefined NaN,http://aciar.gov.au/training/JDF
The Estonian Institute - Research Scholarships,Phd,NaN undefined NaN,
FUNIBER FORMATION SCHOLARSHIPS (Fundación Universitaria Iberoamericana),"Bachelor, Master, Phd",NaN undefined NaN,http://www.funiber.us/scholarships/
Scholarship Fund of Polish History Museum,Phd,NaN undefined NaN,
European Molecular Biology Long-Term Fellowships,Phd,NaN undefined NaN,
Graduate Women International (GWI) - fellowships and grants,Phd,NaN undefined NaN,
ROTARY GLOBAL GRANTS,"Master, Phd",NaN undefined NaN,https://www.rotary.org/myrotary/en/take-action/apply-grants/global-grants
European Molecular Biology Short-Term Fellowships,Phd,NaN undefined NaN,http://www.embo.org/funding-awards/fellowships/short-term-fellowships
National Research Council (CNR) - Short-term mobility - STM,Phd,NaN undefined NaN,
Mawista Scholarship for Students Studying Abroad with a Child,"Bachelor, Master",NaN undefined NaN,https://www.mawista.com/en/scholarship/
Calihan Travel Grant Program - Acton Institute,Phd,NaN undefined NaN,
Pfizer Worldwide Research and Development Postdoctoral Program,Phd,NaN undefined NaN,
"Paul Sumerall Memorial Scholarships, Merchants Bank of California",Master,NaN undefined NaN,http://www.imtconferences.com/about/paul-sumerall-memorial-scholarship/
Short Term Grant for Armenian Studies - Calouste Gulbenkian Foundation,"Master, Phd",NaN undefined NaN,
Frederick Soddy Award - Royal Geographical Society,Phd,NaN undefined NaN,
Visiting Student Program (VSP) - Raman Research Institute,Phd,NaN undefined NaN,http://www.rri.res.in/visitingstudents.html
The Boehringer Ingelheim Fonds - Travel grants for junior researchers,Phd,NaN undefined NaN,http://www.bifonds.de/fellowships-grants/travel-grants.html
The Boehringer Ingelheim Fonds awards PhD fellowships,Phd,NaN undefined NaN,http://www.bifonds.de/fellowships-grants/phd-fellowships.html
International Council of Ophthalmology (ICO) - Three-Month Fellowships,Phd,NaN undefined NaN,http://icoph.org/refocusing_education/fellowships/fellowships_more_information.html#three
Harvard GSD 2017 Wheelwright Prize - Travel-Based Research Grants,Phd,31 January 2017,http://wheelwrightprize.org/
Cusanuswerk - Stipendien,Phd,NaN undefined NaN,
Overseas Development Institute (ODI) Fellowship Scheme,Phd,NaN undefined NaN,http://www.odi.org/fellowship-scheme
Adobe Research Women-in-Technology Scholarship,Bachelor,NaN undefined NaN,https://research.adobe.com/scholarship/
EUROPARC-STIPENDIEN,Phd,NaN undefined NaN,
ECCO Fellowships and Grants,Phd,NaN undefined NaN,
Schwarzkopf Travel Grants for Young Europeans,Phd,NaN undefined NaN,http://schwarzkopf-stiftung.de/en/awards/reisestipendien/
United World Colleges (UWC) - International Youth Scholarships,"Bachelor, Master",NaN undefined NaN,
YFU (Youth for Undestanding) - Youth Exchange,Not Funded,,https://www.yfu.org/
Erasmus Exchange Programme,Fully Funded,,http://ec.europa.eu/programmes/erasmus-plus/index_en.htm
Alexia Foundation 2017 Student Grants,Phd,14 February 2017,http://www.alexiafoundation.org/grants/student_rules
International Pharmaceutical Students’ Federation (IPSF) - Student Exchange Programme (SEP),Not Funded,,
Hayek Fund for Scholars - Institute for Humane Studies at George Mason University,Phd,NaN undefined NaN,https://www.theihs.org/hayek-fund
The Indian Technical and Economic Cooperation (ITEC) Programme,Phd,NaN undefined NaN,http://itec.mea.gov.in/?1320?000
ArtUniverse Scholarships,"Bachelor, Master, Phd",NaN undefined NaN,http://www.artuniverse.org/scholarships
Axol Science Scholarship for Graduate or Undergraduate Degree Programs,"Bachelor, Master, Phd",NaN undefined NaN,http://www.axolbio.com/page/axol-science-scholarship
The Leakey Foundation’s Research Grants to doctoral students,Phd,NaN undefined NaN,http://www.leakeyfoundation.org/research-grants/
The Harry Frank Guggenheim Foundation Research Grants,Phd,NaN undefined NaN,http://www.hfg.org/rg/guidelines.htm
Amelia Earhart Fellowship,Phd,NaN undefined NaN,http://zonta-ak.org/scholarships/amelia-earhart-fellowship/
Global Leader Scholarship Program ,Bachelor,30 November 2016,http://w-square.com/english/information/apply-now-global-leader-scholarship-program-april-2017-intake/
Be an exchange student for 1-2 semesters,Not Funded,,https://en.wikipedia.org/wiki/Student_exchange_program
Horizon 2020,Phd,NaN undefined NaN,http://ec.europa.eu/programmes/horizon2020/en/what-horizon-2020
POST-DOCTORAL FELLOWSHIPS - AXA Research Fund,Phd,30 May 2017,https://www.axa-research.org/en/page/post-doctoral-fellowships
PRESTIGE Postdoc Program 2017,Phd,31 December 2016,http://www.campusfrance.org/en/prestige
Exchange programs for Medical students,Partially Funded,,
Graduate Scholar Awards for Interdisciplinary Social Sciences Conferences,Phd,NaN undefined NaN,
Facebook Emerging Scholar Award Program,Phd,28 February 2017,https://research.facebook.com/programs/emerging_scholar_program/
"Call for Scholarship Applications 2017, Dan David Prize",Phd,10 March 2017,http://www.dandavidprize.org/scholarship-applications
Manualbirds Video Scholarship Program,"Bachelor, Master",27 February 2017,
Research Scholarship by EditnPublish,"Bachelor, Master",31 December 2016,http://www.editnpublish.com/scholarships/
Graduate Women International (GWI) - International Awards,Phd,NaN undefined NaN,http://www.graduatewomen.org/what-we-do/grants-fellowships/international-awards/
Bayer Fellowship Program - Promoting Talents Across Borders,"Master, Phd",18 July 2017,
Hegg Hoffet Fund for Displaced Women Graduates,"Phd, Bachelor, Master",NaN undefined NaN,http://www.graduatewomen.org/what-we-do/grants-fellowships/hegg-hoffet/
United World Colleges (UWC) International Youth Scholarships,,,
Full Distance Learning Scholarships for East and South African Students at London South Bank University,,,
Volunteer of the Year,"Bachelor, Master, Phd",,https://www.volunteerhq.org/ivhq-scholarships
Conacyt scholarship,"Master, Phd",,
Civil Society Leadership Awards,,,
