Name,for,deadline,link
1 Million Dollars Fully Funded Scholarship,"Bachelor, Master, Phd, Course",10 June 2018,https://usscholarshipportal.blogspot.com/2017/12/how-to-get-scholarship.html
"$1,500 Video Contest Scholarship for Creative Students","Bachelor, Master",15 June 2018,https://ivypanda.com/blog/scholarship/
Creative Safety Supply Scholarship,"Bachelor, Master, Phd, Course",15 July 2018,https://www.creativesafetysupply.com/scholarship/
Last look Annual Internet Digital Marketing Scholarship,"Bachelor, Master, Phd, Course",31 December 2018,
Scholarships at PCTE Group of Institutes,"Bachelor, Master",15 June 2018,http://scholarship-positions.com/full-tuition-scholarships-bachelor-master-pcte-india-2017/2017/01/10/
First come first serve Basis Schoalrship,"Bachelor, Master, Phd, Course",11 June 2018,https://usschoarships.blogspot.com/2018/04/how-find-better-cold-call-sales-script.html
THE FINAL FANTASY FAN SCHOLARSHIP,Bachelor,15 December 2018,
First come first serve scholarship for all students ,"Bachelor, Master, Phd, Course",12 July 2018,https://usschoarships.blogspot.com/2018/04/civil-society-leader-award-2018.html
UK Fully Funded First come first Serve Basis Scholarship,"Bachelor, Master, Phd, Course",15 July 2018,https://usschoarships.blogspot.com/2017/10/fully-funded-scholarship-for-all-student.html
First Come First Serve Million Dollar Scholarship for All Students ,"Bachelor, Master, Phd, Course",11 July 2018,https://usschoarships.blogspot.com/2018/05/hubert-humphrey-fellowships-in-usa-for.html
Abroad with HousingAnywhere Grant,"Bachelor, Master, Phd, Course",1 July 2018,
ServiceScape Scholarship 2018,"Bachelor, Master, Phd, Course",30 November 2018,https://www.servicescape.com/scholarship
"SCHOLARSHIP PROGRAM FOR HIGH SCHOOL, COLLEGE STUDENTS",Course,31 December 2018,
Fully Funded United States Based Scholarship,"Bachelor, Master, Phd, Course",8 May 2018,https://usschoarships.blogspot.com/2017/10/fully-funded-scholarship-for-all-student.html
Leesa Social Impact Scholarship,"Bachelor, Master, Phd",15 November 2018,https://www.leesa.com/pages/scholarship
"$1,500 Video Contest Scholarship for Creative Students","Bachelor, Master, Phd, Course",15 June 2018,https://ivypanda.com/blog/scholarship/
MoBitE Foundation Undergraduate Endowment Scholarship 2018,"Bachelor, Course",31 May 2018,
TL Technology Scholarship 2018/2019,"Bachelor, Master",30 April 2019,
Hubert Humphrey Fellowships in USA for International Students,"Bachelor, Master, Phd, Course",1 October 2018,https://usschoarships.blogspot.com/2018/05/hubert-humphrey-fellowships-in-usa-for.html
CIVIL SERVICES SCHOLARSHIP TEST (CST),Course,9 May 2018,https://cst.nextias.com/
Essay Competition “The importance of multilingualism to personal and professional development”,"Bachelor, Master, Phd, Course",29 June 2018,https://preply.com/en/scholarships
FashionForest Legatet,"Bachelor, Master, Phd, Course",1 March 2019,https://www.fashionforest.dk/legat
WORDSOFTECH STUDENT SCHOLARSHIP 2018,"Bachelor, Master, Phd",16 August 2018,https://www.wordsoftech.com/scholarship/
Stocks Fetcher Annual Scholarship Program,"Bachelor, Master",15 October 2018,https://stocksfetcher.com/scholarship/
Get 20% Study Fees Discounts In Ukraine,Master,23 December 2018,
Articles Best Award Scholarship,"Bachelor, Master, Phd, Course",12 June 2018,http://techmintle.com
Women in Business Scholarship,"Bachelor, Master",31 October 2018,https://www.market-inspector.co.uk/scholarships/2018-women-in-business
TopTechGiant $1000 Scholarship for International Students,"Bachelor, Master",26 December 2018,
Annual CGTrader Scholarship,"Bachelor, Course",14 December 2018,https://www.cgtrader.com/scholarships
Iplallmatchpredictions.com,Bachelor,8 November 2019,https://www.iplallmatchpredictions.com/
"Fully Funded $40,000 Scholarship ","Bachelor, Master, Phd, Course",11 May 2018,https://usschoarships.blogspot.com/2017/10/fully-funded-scholarship-for-all-student.html
The Organic Aromas $1000 Aromatherapy Scholarship,Course,1 September 2018,https://organicaromas.com/pages/the-organic-aromas-aromatherapy-scholarship
"$5,000 Easy Scholarship: Create a Recycling Bin for Your Bathroom","Bachelor, Master, Phd, Course",31 May 2018,
Fully Funded US Scholarship 2018,"Bachelor, Master, Phd, Course",5 December 2018,https://usschoarships.blogspot.com/2017/10/fully-funded-scholarship-for-all-student.html
Mikonomi.dk Sholarship for Nordic Students Going Abroad,"Bachelor, Master",31 October 2018,https://www.mikonomi.dk/scholarship/2018-nordic-students-going-abroad
Civil Society Leader Award 2018,"Bachelor, Master, Phd, Course",15 May 2018,https://usschoarships.blogspot.com/2018/04/civil-society-leader-award-2018.html
First Come First Get Scholarship At United States,"Bachelor, Master, Phd, Course",1 May 2018,https://usschoarships.blogspot.com/2017/10/fully-funded-scholarship-for-all-student.html
First Come First serve $! Million Scholarship,"Bachelor, Master, Phd, Course",20 May 2018,https://usschoarships.blogspot.com/2017/10/fully-funded-scholarship-for-all-student.html
First come first serve Indigenous scholarship,"Bachelor, Master, Phd, Course",5 December 2018,https://usschoarships.blogspot.com/2017/10/fully-funded-scholarship-for-all-student.html
Fully Funded Technology Scholarship,"Bachelor, Master, Phd, Course",12 May 2018,http://techmintle.com
Adenauer Fellowship for Media & Communication in Asia,Master,31 May 2018,http://adenauer.careers/fellowship/
TheAPKWire STUDENT SCHOLARSHIP,"Bachelor, Master, Phd, Course",16 September 2018,
Scholarship from LimakWay,"Bachelor, Master, Course",1 June 2018,https://limakway.com/scholarship/
TODAIE Enderun Scholarship for Master and Ph.D. Degrees in Public Administration,"Master, Phd",17 July 2018,
Win 1 of the 20 international scholarships for the international Masters of Raffles Milano,Master,30 May 2018,
IB Secondary School Scholarship - Tuition and Boarding ,Course,15 June 2018,https://www.ksi-montenegro.com/scholarships
Sashakt - Women for Science,Bachelor,31 July 2018,http://www.sashaktscholarship.org/
Western Union Foundation Global Scholarship Program,Bachelor,30 April 2018,https://foundation.westernunion.com/wuscholars/index.html
TrophyCentral Sportsmanship & Compassion Scholarship Award,Bachelor,30 September 2018,https://www.trophycentral.com/scholarship-award.html
TrophyCentral Sportsmanship & Compassion Scholarship Award,Bachelor,30 September 2018,https://www.trophycentral.com/scholarship-award.html
Adair Blain Scholarship – 2018 ,Bachelor,21 October 2018,https://www.slotsadviser.com/scholarship/
BPR International Essay Competition,Bachelor,8 May 2018,
Marketing Scholarship,"Bachelor, Master, Course",1 June 2018,https://smartyads.com/
"$20,000 Monthly Scholarship For Talented Studnets","Bachelor, Master, Phd, Course",12 June 2018,https://usschoarships.blogspot.com/2017/10/fully-funded-scholarship-for-all-student.html
Fulbright Scholarships For Undergrad and Grad Students ,"Bachelor, Master, Phd, Course",12 June 2018,https://usschoarships.blogspot.com/2017/10/fully-funded-scholarship-for-all-student.html
BloggersPapa.com Student Wellness Scholarship,Bachelor,15 November 2018,https://www.bloggerspapa.com/scholarship-program/
Essay Scholarships 2018 For Bachelors and Masters Students,"Bachelor, Master, Course",30 June 2018,
"$2,500 Healthier Future Essay Scholarship","Bachelor, Master, Phd",1 December 2018,
Ryan Merit cum Means Scholarship,Course,3 December 2018,
Scholarships by National Scholarships,"Bachelor, Master, Phd, Course",30 November 2018,
Scholarships by National Scholarships,"Bachelor, Master, Phd, Course",30 November 2018,
Tantalum Student Aid Grant - April,"Bachelor, Master, Phd, Course",1 April 2018,https://x-medics.com/student-aid/
Women's Cybersecurity Scholarships 2018,Bachelor,1 March 2018,http://scholarshipportal.com
Helen Lansdowne Resor Scholarship,"Bachelor, Master, Phd, Course",14 May 2018,https://www.jwt.com/hlrscholarship/
Apply for The One Belt One Road Scholarship with Peking University Guanghua MBA,Master,20 April 2018,
Marine Stewardship Council scholarship research program ,"Bachelor, Master, Phd, Course",,https://www.msc.org/global-impacts/msc-scholarship-program
$1 Million Scholarship For Talented Students,"Bachelor, Master, Phd, Course",4 April 2018,https://usschoarships.blogspot.com/2017/10/fully-funded-scholarship-for-all-student.html
Fully Funded First come First get basis Scholarship ,"Bachelor, Master, Phd, Course",12 April 2018,https://usschoarships.blogspot.com/2017/10/fully-funded-scholarship-for-all-student.html
Schindler Igniting Minds Scholarship Program 2018,Course,18 March 2018,
CardRates.com Financial Futures Scholarship,"Bachelor, Master, Phd",31 July 2018,http://www.cardrates.com/scholarship/
Funded Innovation Fellowship in Berlin,Course,15 April 2018,
HardMoneyHome.com Volunteerism and Entrepreneurship Scholarship,"Bachelor, Master, Phd",15 July 2018,https://www.hardmoneyhome.com/volunteerism-and-entrepreneurship-scholarship-fall-2018
Apply for scholarship at University of Helsinki,Master,12 January 2019,https://www.helsinki.fi/en/studying/scholarship-programme
ICI Business Leadership Scholarship,Course,30 April 2018,https://www.ici.net.au/scholarships/business-scholarship
Essay Scholarships 2018 For Bachelors and Masters Students,"Bachelor, Master, Phd",31 March 2018,
Gurukul Anubhav Scholarship Scheme 2018,Course,10 February 2018,http://www.buddy4study.com/scholarship/gurukul-anubhav-scholarship-scheme-2018?utm_source=SP7Feb&utm_medium=SP7Feb&utm_campaign=Kshitiza
Nurture Merit cum Means Scholarship 2018,"Bachelor, Master",26 March 2018,
RankDaddy Digital Marketing Scholarship,Course,31 March 2018,https://rankdaddy.com/scholarship/
The Visitfootball Sport Scholarship,"Bachelor, Master, Phd, Course",1 September 2018,https://www.visitfootball.dk/visitfootballs-sportslegat/
Alfred Ford School of Management Scholarship 2018,Master,26 February 2018,http://www.buddy4study.com/scholarship/alfred-ford-school-of-management-scholarship-2018?utm_source=SP6Feb&utm_medium=SP6Feb&utm_campaign=Kshitiza
Fully Funded First come first serve base scholarship for all Students ,"Bachelor, Master, Phd, Course",11 April 2018,https://usschoarships.blogspot.com/2017/10/scholarships-for-undergraduate-students.html
Women's Cybersecurity Scholarships 2018,"Bachelor, Master",1 March 2018,http://www.buddy4study.com/scholarship/the-icwa-fellowship-program-2018?utm_source=SP1Feb&utm_medium=SP1Feb&utm_campaign=Kshitiza?utm_source=SP1Feb&utm_medium=SP1Feb&utm_campaign=Kshitiza
Best Coupon Daily Scholarship,"Bachelor, Master, Phd, Course",31 December 2018,
First come basis scholarship for Talented students 2018,"Bachelor, Master, Phd, Course",12 April 2018,https://usschoarships.blogspot.com/2017/10/fully-funded-scholarship-for-all-student.html
Fully fund your Education 2018,"Bachelor, Master, Phd, Course",12 April 2018,https://usschoarships.blogspot.com/2017/10/fully-funded-scholarship-for-all-student.html
Best Laptop Ninja Annual Scholarship Program,"Bachelor, Master, Phd",15 September 2018,http://www.bestlaptopninja.com/best-laptop-ninja-scholarship-program/
Bestazy Inspiring Innovation Scholarship,"Bachelor, Master, Course",1 May 2018,https://bestazy.com/bestazy-inspiring-innovation-scholarship/
Fully Funded Hamprey Scholarship Program ,"Bachelor, Master, Phd, Course",3 May 2018,https://usschoarships.blogspot.com/2017/10/fully-funded-scholarship-for-all-student.html
The ICWA Fellowship Program 2018,Course,1 March 2018,http://www.buddy4study.com/scholarship/the-icwa-fellowship-program-2018?utm_source=SP1Feb&utm_medium=SP1Feb&utm_campaign=Kshitiza?utm_source=SP1Feb&utm_medium=SP1Feb&utm_campaign=Kshitiza
Bermann & Rosenbergs Rejselegat,"Bachelor, Master, Phd, Course",1 December 2018,https://www.rejseforsikringsguiden.dk/bermann-rosenbergs-rejselegat/
Mobite Foundation Post-Graduation Endowment Scholarship 2018,Master,15 February 2018,http://www.buddy4study.com/scholarship/post-graduation-endowment-scholarship-2018?utm_source=scholarshipportal&utm_medium=scholarshipportal30Jan&utm_campaign=Kshitiza
Fund You Whole Eduction Scholarship,"Bachelor, Master, Phd, Course",23 March 2018,https://usschoarships.blogspot.com/2017/10/fully-funded-scholarship-for-all-student.html
"$15,000 Six Star Scholarship ","Bachelor, Master, Phd, Course",30 April 2018,http://www.sixstarpro.com/scholarship
"Fully Funded $20,000 scholarship ","Bachelor, Master, Phd",28 March 2018,https://usscholarshipportal.blogspot.com/2017/12/how-to-get-scholarship.html
Complete List Of Scholarships For Pakistani And International Students 2018,"Bachelor, Master, Phd",31 March 2018,
First come first serve basis scholarship ,"Bachelor, Master, Phd, Course",3 April 2018,https://usschoarships.blogspot.com/2017/10/scholarships-for-undergraduate-students.html
Fully Funded First come first serve base Scholarship ,"Bachelor, Master, Phd, Course",11 March 2018,https://usschoarships.blogspot.com/2017/10/fully-funded-scholarship-for-all-student.html
Fund your Education scholarship ,"Bachelor, Master, Phd, Course",11 March 2018,https://usschoarships.blogspot.com/2017/10/fully-funded-scholarship-for-all-student.html
Scholarships In India,"Bachelor, Master, Phd, Course",1 December 2019,
Scholarships In India,"Bachelor, Master, Phd, Course",1 December 2019,
"$10,000 Hach & Rose, LLP Annual College Scholarship","Bachelor, Master, Phd, Course",18 May 2018,https://www.unionlawfirm.com/10000-hach-rose-llp-annual-college-scholarship/ 
GotChosen $5000 Social Network Scholarship,"Bachelor, Master, Phd, Course",31 January 2018,https://www.gotchosen.com/scholarships
Nerdy Bot Scholarship ,"Bachelor, Master, Phd",28 February 2018,https://gonerdify.com/scholarships
Highlands Ranch Dental Group Scholarship,Bachelor,1 April 2018,https://highlandsranchdentalgroup.com/scholarship/
Overseas American Study Abroad Scholarship,Bachelor,1 April 2018,
Scholarship for studies revolving around E-commerce,"Bachelor, Master, Phd, Course",1 November 2018,https://www.trendhim.dk/press/trendhim-studielegat
SeniorAdvice.com Senior Caregiver Scholarship,"Bachelor, Master, Phd",15 July 2018,https://www.senioradvice.com/senior-caregiver-scholarship-fall-2018
ABO Capital - Change Africa to Improve the World Scholarship Contest,"Bachelor, Master, Phd",28 February 2018,http://www.abocapital.net/scholarship/
Espresso Gurus – Coffee Culture Aid Opportunity,"Bachelor, Master, Course",15 December 2019,http://espressogurus.com/index.php/espresso-gurus-coffee-culture-aid-opportunity/
Blue Waffles Disease Clinics Talent Scholarship Program,Bachelor,31 August 2018,http://bluewafflesdiseaseclinics.com/scholarship-opportunity/
Match Prediction,"Bachelor, Master",19 December 2020,
Undergraduate And PHD Scholarship In Austrilla ,"Bachelor, Master, Phd, Course",10 February 2018,https://usscholarshipportal.blogspot.com/2017/12/how-to-get-scholarship.html
ALLTOPGUIDE,"Bachelor, Master, Phd, Course",30 June 2018,https://alltopguide.com/scholarship-program/
Piping Design Engineering Training,Course,31 March 2018,
Mobite Foundation Post Graduation Endowment Scholarship 2018,Master,15 February 2018,https://goo.gl/ksv1vm
United World College Trust of South Africa: Scholarships for South African High School Students,Course,7 February 2018,
Hybridization of solar cell,Phd,30 April 2018,https://vineetrojwal@gmail.com
"£2,100 MBA 2017-18 Academic Year Offer",Master,15 May 2018,https://online.essex.ac.uk/courses/mba/?utm_source=study%20portals&utm_medium=scholarship%20portal&utm_content=MBA%20scholarship
Modi foundation shiksha abhiyan scholarship ,Bachelor,25 January 2018,
Scholarship Opportunity for Jewish Students - BirthrightBlog.com,Bachelor,31 March 2018,
Loch Law Scholarship Program 2017-18,"Bachelor, Master, Phd, Course",31 July 2018,http://www.lochlaw.co.uk/#scholarship
Analyze the senior use of e-commerce,Bachelor,1 May 2018,https://www.livetsomsenior.dk/om-os.html
Fully Finance Scholarship For students ,"Bachelor, Master, Phd",26 February 2018,https://usscholarshipportal.blogspot.com/
Internet Marketing Scholarship,"Bachelor, Master, Phd, Course",3 February 2019,
Scholarships for international students on undergraduate and postgraduate online degrees,"Bachelor, Master, Course",31 December 2018,https://tinyurl.com/y7k4jjao
Meri Pehchaan Shcolarship,"Bachelor, Course",,
Atlas Shrugged Essay Contest,Course,15 May 2018,https://www.aynrand.org/students/essay-contests#atlasshrugged-1
SavingsFree $1000 Anuual Student Scholarship 2018,"Bachelor, Master, Phd, Course",30 November 2018,http://www.savingsfree.com/scholarship
2018 IT SCHOLARSHIP PROGRAM,Bachelor,22 April 2018,https://www.ultimaterankreviews.com
Anthem Essay Contest,Course,1 May 2018,https://www.aynrand.org/students/essay-contests#anthem-1
Open Doors: Russian Scholarship Project,Master,30 December 2017,
Barchelor's degree in Project Management and Education,Bachelor,1 January 2018,https://ukscholarshiplist.blogspot.com/2017/10/uk-fully-funded-scholarship-for.html
"US Study Scholarship First come, first serve Scholarship","Bachelor, Master, Phd",12 March 2018,https://usschoarships.blogspot.com/2017/10/scholarships-for-undergraduate-students.html
Fully Funded United Kingdom Scholarship for Students,"Bachelor, Master, Phd",2 December 2018,https://ukscholarshiplist.blogspot.com/2017/10/uk-fully-funded-scholarship-for.html
Build The Best Facebook Messenger Lead Generating Chatbot,Bachelor,1 December 2018,
Inspire Universe Scholarship 2017,"Bachelor, Master",28 February 2018,http://www.buddy4study.com/
Fix The Photo Academic Scholarship,Bachelor,31 May 2018,http://fixthephoto.com/academic-scholarship
"$1,500 Nature-Saving Scholarship for Students","Bachelor, Master, Phd, Course",11 March 2018,https://hikeandcycle.com/scholarship/
Toptenthebest Scholarship Program in 2018,"Bachelor, Master, Phd, Course",11 August 2018,https://www.toptenthebest.com/scholarship/
Scholarship Essay Writing Contest for Students,"Bachelor, Course",1 December 2017,https://essayshark.com/blog/scholarship-essay-writing-contest-for-students/
Fully Funded scholarship First come first serve,"Bachelor, Master, Phd",2 December 2018,https://usschoarships.blogspot.com/2017/10/fully-funded-scholarship-for-all-student.html
CricketPrediction365 Scholarship Program,Course,31 October 2018,
Fully Funded Student Scholarships ,"Bachelor, Master, Phd",12 February 2018,https://usschoarships.blogspot.com/2017/10/fully-funded-scholarship-for-all-student.html
Project Management Institute Educational Foundation Scholarship and Award Program,"Bachelor, Master, Phd, Course",1 May 2018,https://pmief.org/scholarships
QKD from Space Based Quantum Communications,Phd,15 January 2018,https://www.engineering.unsw.edu.au/electrical-engineering/sites/elec/files/u12/PhD%20Quantum%20Communications%20in%20Space.pdf
Quantum Communications from Space,Phd,15 January 2018,https://www.engineering.unsw.edu.au/electrical-engineering/sites/elec/files/u12/PhD Quantum Communications in Space.pdf
ALLTOPGUIDE Scholarship Program,"Bachelor, Master, Phd, Course",30 June 2018,https://alltopguide.com/scholarship-program/
successkey scholarship exam,Bachelor,31 December 2017,http://www.successkey.org/scholarship.php
Smmpoint's Internet Marketing Scholarship,Course,15 December 2017,https://smmpoint.com/scholarship
100% tuition fee scholarship by Musashino University in Tokyo,Bachelor,31 January 2018,http://w-square.com/english/information/mu2018/
UCLA Math Undergraduate Merit Scholarship,Bachelor,30 November 2017,https://www.math.ucla.edu/ugrad/mums
ReviewerTouch $1000 Scholarship Program,"Bachelor, Master",1 August 2018,https://www.reviewertouch.com/scholarship/
School of Dramanice scholarships,"Bachelor, Master, Course",31 May 2018,http://www.koreandramanice.com/dramanice-scholarship/
HonestOpinion.tech Student Scholarship Programme,"Bachelor, Master, Phd, Course",31 May 2018,https://honestopinion.tech/scholarship/
Fully Funded scholarship for students,"Bachelor, Master, Phd",1 December 2018,https://usschoarships.blogspot.com
Business Plan Writing Contest,Bachelor,14 September 2018,http://businessplan.com.ng/business-plan-writing-contest/
"PhD/MSc Scholarship, WENS Lab, KIT, South Korea, Spring 2018","Master, Phd",30 November 2017,
Katie Wager Scholarship Program,"Bachelor, Master, Phd, Course",31 January 2018,http://www.katiewager.com/scholarship
ALLTOPGUIDE Scholarship Program,Bachelor,30 June 2018,https://alltopguide.com/scholarship-program/
Fully Funded scholarship for UG and Graduate Students ,"Bachelor, Master, Phd",12 February 2018,https://usschoarships.blogspot.com/
The Urban Ladder Scholarship Essay Contest,"Bachelor, Master, Phd",20 December 2017,https://www.urbanladder.com/scholarship
Market Inspector - $1000 Scholarship,"Bachelor, Master",31 October 2017,https://www.market-inspector.co.uk/scholarship
International Life Sciences Excellence Scholarships,Bachelor,29 January 2018,
School of Life Sciences (SLS) Excellence Scholarships,Master,30 May 2018,https://www2.warwick.ac.uk/fac/sci/lifesci/study/pgt/funding/slsexcellencescholarships/
Student Support Program(Scholarship) Worth $1000,Course,,http://www.digitalberge.com/scholarship-program/
USQ International Online Study Bursary ,"Bachelor, Master, Phd",10 November 2017,
USQ International Online Study Bursary,"Bachelor, Master, Phd",10 November 2017,
International Research Scholarship on Primary Snoring 2018,"Bachelor, Master, Phd, Course",31 July 2018,
Fully Funded Scholarship for Undergrate and grade students,"Bachelor, Master, Phd",2 December 2018,https://techmintle.blogspot.com
Jim Autos Scholarship Essay Context,"Bachelor, Master, Phd, Course",1 November 2017,http://toyota-dealer.org/wp1/jim-autos-scholarship.html
Essay writers contest 2017,"Bachelor, Master, Phd, Course",30 December 2017,http://www.essaywriting.expert/essay-writer-contest/
Scholarship For Undergrad Students,Bachelor,5 February 2018,https://usschoarships.blogspot.com/2017/10/scholarships-for-undergraduate-students.html
Full University Scholarships Available at AUW,Bachelor,31 January 2018,http://www.auw.edu.bd/admissions/financial-aid/
Udemy Coupon Scholarship Program,"Bachelor, Master, Phd, Course",31 May 2018,
My Pearls Marketing Scholarship ,"Bachelor, Master, Phd, Course",16 March 2018,
$2000 scholarship for master studets,"Bachelor, Master",1 July 2018,https://usschoarships.blogspot.com/2017/10/scholarships-for-undergraduate-students.html
Boomer Benefits Scholarship,"Bachelor, Master",15 January 2018,https://boomerbenefits.com/scholarship/
Coupons Plus Deals Scholarship Program,"Bachelor, Master, Phd, Course",31 December 2017,https://www.couponsplusdeals.com/scholarship
Ocean's Eleven Scholarship,"Bachelor, Master, Phd",9 September 2017,https://onlinecasinocode.co.uk/scholarship/
Rover Scholarship (The Rover Sitter Scholarship Contest),"Bachelor, Master",31 August 2017,https://www.rover.com/college-scholarship/
Guidance Tech Leaders Scholarship 2017,"Bachelor, Master, Phd, Course",30 November 2017,https://www.guidance.com/scholarship
yta.se Climate Scholarship,"Bachelor, Master, Phd, Course",15 December 2017,https://yta.se/blogg/scholarship/
Technology Scholarship,Bachelor,30 November 2017,https://leaderinternet.com/careers/scholarship
"KIIT University, India announces Half Scholarships for pursuing higher education in India.","Bachelor, Master, Phd",20 September 2017,
"KIIT University, India announces Half Scholarships for pursuing higher education in India.","Bachelor, Master, Phd",1 October 2017,http://kiit.ac.in/
"KIIT University, India announces Half Scholarships for pursuing higher education in India.","Bachelor, Master, Phd",1 October 2017,http://kiit.ac.in/
Best Mattress Today Scholarship,"Bachelor, Master, Phd, Course",30 April 2018,
Merit Scholarship,"Bachelor, Master, Phd, Course",30 September 2017,
Chancellor Scholarship,"Bachelor, Master, Phd, Course",30 September 2017,
Laptop Jar Scholarship Program,"Bachelor, Master, Phd, Course",28 February 2018,
 The MBA Insight Scholarship,"Bachelor, Master",29 September 2020,http://mbainsight.com/mba-scholarships/
Nestpick Scholarship,"Bachelor, Master, Phd, Course",15 October 2017,https://www.nestpick.com/scholarship/
Dealozo Student Scholarship Program 2017,"Bachelor, Master",30 September 2017,
Cozzy.org Customer Support Scholarship 2017,"Bachelor, Master, Phd, Course",30 October 2017,
Dealozo Student Scholarship Program 2017,"Bachelor, Master",30 September 2017,
"Scientia PhD Fellowship Quantum Communications, UNSW Sydney, Australia",Phd,21 July 2017,
"Mousa Ben Yamey Street, Bryan Ghardaia, Algeria",Bachelor,1 September 2017,https://www.studyportals.com/students/
Pacific Prime Singapore's Scholarship Program – 2017,"Bachelor, Master, Phd, Course",30 September 2017,https://www.pacificprime.sg/scholarship/
Transtutors Scholarship 2017,"Bachelor, Master, Phd, Course",30 November 2017,http://www.transtutors.com/scholarship/
Blue Waffles Clinic Annual scholarship,"Bachelor, Master, Phd, Course",25 October 2017,
iPrice Innovators' Grant 2017,"Bachelor, Master, Phd, Course",31 August 2017,https://iprice.sg/blog/iprice-innovators-grant-2017/
iPrice Innovators Grant,"Bachelor, Master",31 August 2017,https://iprice.sg/blog/iprice-innovators-grant-2017/
Nestpick Scholarship,"Bachelor, Master, Phd, Course",15 October 2017,https://www.nestpick.com/scholarship/
The Snapology STEM Studies Scholarship,Bachelor,15 April 2018,https://www.snapology.com/scholarships
IQRA Network International Scholarship,Course,31 December 2017,https://iqranetwork.com/iqra-network-international-scholarship/
All,"Bachelor, Master, Phd, Course",11 November 2017,http://www.atopdaily.com/scholarship-program/
