Name,for,deadline,link
Global Student Contest Scholarships,"Master, Bachelor, Course",1 December 2021,https://kidatschool.com/global-student-contest-scholarships
CouponsXDeals Scholarship,Bachelor,31 December 2020,https://couponsxdeals.com/scholarship
Women In Tech '21 Scholarship Program | GreyCampus,Course,15 March 2021,https://www.greycampus.com/scholarships/women-in-tech
Google Anita Borg Memorial Scholarships for International Students at Arizona State University,Bachelor,,https://admissions.arizona.edu/cost-aid/international/scholarships-loans
Undergraduate KDS Scholarship Contest,"Master, Bachelor",1 October 2021,https://kidatschool.com/contest-program-scholarships/
Sustainability funding for International Students,Master,12 April 2021,https://www.finduddannelse.dk/scholarship/finduddannelsedk-sustainability-scholarship-17947#eli
special programmes at Northcap University,Bachelor,,
InvestoRunner Scholarship,Master,31 October 2020,https://investorunner.com/scholarship/
International KSS Contest Scholarship for College Students,"Bachelor, Course, Master",31 October 2021,https://kidatschool.com/international-kss-contest-scholarship-2021
Creative Writing International Competition,"Course, Bachelor, Master, Phd",30 April 2021,https://competition.kanac.org/
2021 Contest Scholarships for International Students,"Master, Bachelor, Course",1 June 2022,https://kidatschool.com/2021-contest-scholarships
International KAS Contest Scholarship 2021,"Master, Course, Bachelor",1 December 2021,https://kidatschool.com/international-kas-contest-scholarship-2021
Athena Study in India Scholarship,Bachelor,28 March 2021,https://athenaeducation.net
Latin America & Brazil Scholarships at Niagara College,Bachelor,1 February 2021,https://international.niagaracollege.ca/scholarships/#entrance-scholarships
BEROWS INTERNATIONAL SCHOLARSHIP PROGRAM TEST (BISPT),"Master, Bachelor, Phd",31 March 2021,https://bispt.com/
IUBH University of Applied Sciences Online Scholarships for International Students in Germany,"Master, Bachelor",,https://www.iubh-online.org/master-degree-programmes/scholarships/
Dermadry Scholarship 2020,"Master, Bachelor, Phd, Course",19 August 2020,https://dermadry.com/pages/scholarship-2020
Dermadry Hyperhidrosis Scholarship 2020,"Master, Bachelor, Phd, Course",19 August 2020,https://dermadry.com/pages/scholarship-2020
Trity Online Scholarship Test for Undergraduate students,Bachelor,20 August 2020,
LWF international awards in Theology,"Course, Bachelor, Master",1 October 2020,https://www.lutheranworld.org/news/applications-open-scholarships-theology-diakonia-and-development
IAEA Marie Sklodowska-Curie International Fellowship Programme in Austria,Master,11 October 2020,https://www.iaea.org/newscenter/news/marie-sklodowska-curie-fellowship-programme-applications-now-open
IELTS Course Scholarship,"Course, Bachelor, Master, Phd",31 December 2020,https://www.ieltspodcast.com/ielts-scholarships/
international scholarship for Girls,"Master, Bachelor, Phd, Course",28 December 2020,https://shebegan.com/application-submission/
Essay Writing Scholarship for Student,"Master, Bachelor, Phd",15 October 2020,https://shebegan.com/essay-writing-scholarship-deadline-for-submission-october-15-2020/
The #YouAreWelcomeHere Scholarship at National Louis University,Bachelor,1 July 2020,
"IvyPanda $1,500 Annual Video Contest Scholarship","Master, Bachelor, Phd, Course",31 October 2020,https://ivypanda.com/scholarship-video
"""Go Digital""","Master, Bachelor, Phd, Course",1 December 2020,https://jelvix.com/scholarship
Reconstructing human-environment interactions in Port Phillip Bay,Phd,15 September 2020,
Michael Giannulis Grant,Bachelor,1 July 2021,https://michaelgiannulisgrant.com/
"$1,500 for Graduate School: KLAS Contest Scholarship","Bachelor, Course",30 October 2020,https://kidatschool.com/klas-student-contest-scholarships-2021
IELTS Exam Fee Waiver Scholarship,"Master, Bachelor, Phd",30 August 2020,https://ieltsdates.com/ielts-test-fee-scholarship-call-for-applications/
finduddannelse.dk sustainability scholarship,Master,12 April 2021,https://www.finduddannelse.dk/scholarship/finduddannelsedk-sustainability-scholarship-17947
Contest Scholarships for Undergraduate Students,"Bachelor, Course",1 May 2021,https://kidatschool.com/scholarships-2020
Kendall College at National Louis University International Opportunity Scholarship,Bachelor,,
Voice Talent Online Scholarship 2020-2021,"Master, Bachelor, Phd, Course",31 January 2021,https://www.voicetalentonline.com/voice-over-agency/scholarship-entry
National Louis University International Opportunity Scholarship,Bachelor,,
Learn Music for free from Suresh Wadkars Acharya Jialal Vasant Sangeet Niketan,Course,15 June 2020,https://sangeetniketan.org/
NSTY Scholarship 2020,"Master, Bachelor, Phd, Course",31 May 2020,
Scholarship for the Best Candidates - Kozminski University,"Master, Bachelor",15 July 2020,https://www.kozminski.edu.pl/en/programs/information/scholarships-and-discounts/
Writing Contest Scholarship 2020,"Master, Bachelor, Phd, Course",31 May 2020,https://admission-writer.com/blog/scholarship
2020 Essay Scholarships for Undergraduate Students,"Bachelor, Course",30 October 2020,https://kidatschool.com/2020-scholarships
"$1,500 Annual Essay Writing Contest Scholarship","Master, Bachelor, Phd, Course",31 May 2020,https://ivypanda.com/scholarship-writing
Sasahkt Scholarship for Women,Bachelor,15 August 2020,http://www.sashaktscholarship.org
The Katoni scholarship - Supporting cultural projects,"Master, Bachelor, Phd",1 May 2020,https://www.katoni.dk/scholarship/
Richard E. Morley Industrial Automation Scholarship,"Master, Bachelor",31 December 2020,https://www.oncampus.eit.edu.au/scholarships.html?utm_source=StudyPortals_Scholarships
The Manchester Full-time MBA Scholarships,Master,1 June 2020,https://bit.ly/2Hg5iU9
The MyUS.com Global Perspectives Scholarship,"Master, Bachelor",1 May 2020,https://www.myus.com/scholarships/the-global-perspectives-scholarship/
Education Future International Scholarship,"Bachelor, Course",15 March 2020,https://www.education-future.org/
International Distinction Awards 2020-2021,"Bachelor, Master",30 June 2021,https://scholarship.mastersportal.com/international-distinction-awards?utm_source=scholarshipportal&utm_medium=referral
Education for Sustainable Energy Development (ESED) Scholarship Program,Master,6 March 2020,https://www.globalelectricity.org/scholarship/how-to-apply/
LSEF-UMass Scholarship,Master,31 July 2020,https://www.lse.foundation
Direct speech center Scholarship,"Master, Bachelor",25 March 2020,https://directindirectspeech.com/scholarship/
British Council IELTS Award 2020,"Master, Bachelor, Phd",10 June 2020,https://www.britishcouncil.de/en/exam/ielts/award
Micro-Scholarships for Online Courses,Course,9 February 2020,https://www.bitdegree.org/scholarships
Student Essays Scholarship,Master,25 March 2020,https://mystudentsessays.com/scholarship
Adobe Design Circle Scholarships for International Students in USA,Bachelor,12 March 2020,https://www.iie.org/Programs/Adobe-Scholarships/Design-Circle-Scholarships/Scholarship-Information
Keto Scholarship 2020,"Master, Bachelor",15 April 2020,https://shebegan.com/keto-scholarship-2020/
Fully-Funded PhD Studentship in Nanochemistry at University of Exeter,Phd,,https://www.exeter.ac.uk/studying/funding/award/?id=3841
AIEED Scholarship Aptitude Test,"Master, Bachelor, Course",29 January 2020,
10% off Your Entire Tuition at Nexford,"Master, Bachelor, Course",7 December 2025,
ANNUAL $2000 STUDENT SCHOLARSHIP,Bachelor,1 October 2020,https://kizi.com/scholarship
OppU Achievers,"Master, Bachelor",30 September 2019,https://www.opploans.com/scholarship/
CALL FOR APPLICATIONS: CLIFF-GRADS SCHOLARSHIP 2019,Phd,30 September 2019,
PEARSON MEPRO ENGLISH SCHOLAR PROGRAM 2019,"Master, Bachelor, Phd, Course",31 August 2019,https://www.buddy4study.com/page/pearson
Dermadry Scholarship 2019,"Master, Bachelor, Phd",21 August 2019,https://dermadry.com/pages/scholarship
COLLEGE BOARD INDIA SCHOLARS PROGRAM,Bachelor,2 November 2019,https://www.buddy4study.com/collegeboard?utm_source=Scholarshiplisting&utm_medium=ScholarshipPortal
$3000 Scholarship Program,"Master, Bachelor, Phd, Course",25 December 2019,https://teetrnd.com/scholarship/
UII Future Global Leaders Scholarships for International Students in Indonesia,Bachelor,30 October 2019,https://pmb.uii.ac.id/international/tuition-fee-scholarship/#tab-id-4
Women in Business Equal Pay Scholarship,"Master, Bachelor",30 November 2019,https://scholarships.nexford.org/women-in-business-scholarships/
Thomas Abraham Understudy Design Fellowship,Course,30 November 2019,https://www.idea-worldwide.com/design-fellowship.php
Academic Scholarship for Online MBA at University of Essex,Master,22 July 2020,https://online.essex.ac.uk/utm-landing-pages/online-mba-degree/?utm_source=scholarship%20portal&utm_medium=weblisting
Your Company Formations Business Scholarship,"Master, Bachelor, Phd, Course",28 August 2020,https://www.yourcompanyformations.co.uk/scholarship-programme/
Science and Law School Scholarship 2019 - 2020,"Master, Bachelor, Phd",30 November 2019,https://afidavit.com/home/
Mewar University Special Scholarship Scheme for Developing Countries,"Master, Bachelor",15 August 2019,http://www.mewaruniversity.org/pages/default.aspx
"Brainers Talent Search Exam BTSC 2019: Scholarships up to ₹ 1,00,000.",Bachelor,18 July 2019,
Phd Miniaturized Sensors for Mars and other planetary bodies,Phd,10 September 2019,https://drive.google.com/file/d/19wRC7RaRl7ld0px9vLYi-dVhKyj8wHQq/view?usp=sharing
Scholarship Contest from Dealroom,"Master, Bachelor, Phd, Course",30 June 2019,https://dealroom.net/dealroom-scholarship
Edward & Isabel Kidson Scholarship to Study Postgraduate,Master,1 October 2019,https://www.universitiesnz.ac.nz/scholarships/edward-isabel-kidson-scholarship
"$5,000 Hach & Rose, LLP Annual College Scholarship","Master, Bachelor, Course",30 June 2019,https://www.unionlawfirm.com/hach-rose-llp-annual-college-scholarship/
Scholarship for students breaking the mold,"Master, Bachelor",31 October 2019,https://www.xn--lnio-qoa.dk/moensterbryder-legat-2019
Next Generation Scholarships,"Master, Bachelor",1 August 2019,
Sustainability Scholarship GreenMatch,"Master, Bachelor",31 October 2019,https://www.greenmatch.co.uk/scholarships/2019-sustainability
Mailcheck Scholarship 1500USD,"Master, Bachelor, Phd",30 September 2019,https://www.mailcheck.co/scholarship
TWAS-SN Bose Postdoctoral Fellowship Programme in India,Phd,30 June 2019,https://twas.org/opportunity/twas-sn-bose-postdoctoral-fellowship-programme
Aashray Scholarship 2019 - Times and Trends academy,Course,3 July 2019,
"Scholarships in Engineering, Pharmacy, Management, Agriculture, etc.","Master, Bachelor",30 July 2019,https://pcte.edu.in
Scholarship for Orphans,Course,15 August 2019,https://www.customessaymeister.com/blog/scholarship-for-orphans
Scholarship for Nordic Students Going Abroad,"Master, Bachelor",31 October 2019,https://www.talouteni.fi/scholarship/2019-scholarship-for-nordic-students-going-abroad
Trendhim Talent Scholarship,"Master, Bachelor, Phd, Course",1 December 2019,https://www.trendhim.com/csr/trendhim-scholarship
Helen Lansdowne Resor Scholarship for Creative Women,"Master, Bachelor, Phd, Course",3 June 2019,
Jelvix Scholarship Program 2019,"Master, Bachelor, Phd, Course",31 July 2019,https://jelvix.com/blog/scholarship-program
Meri Pehchaan - TTA india Academy Scholarship Program,"Master, Bachelor",5 April 2019,
Executive Scholarship for Online MBA at University of Essex,Master,22 July 2020,https://online.essex.ac.uk/utm-landing-pages/online-mba-degree/?utm_source=scholarship%20portal&utm_medium=weblisting
Meri Pehchaan - Times and Trends Academy Scholarship Program,"Bachelor, Course",14 April 2019,
Diabetes Hope Foundation Scholarship,Bachelor,4 March 2019,https://www.dhfscholarship.com
ServiceScape Scholarship 2019,"Master, Bachelor",30 November 2019,https://www.servicescape.com/scholarship
VAPIM Scholarship Aptitude Test (The Scholarship Path to Every Students),Bachelor,10 May 2019,
Qriosity: Nation-wide talent hunt Quiz,Course,7 May 2019,
Fix The Photo Scholarship,"Master, Bachelor",31 August 2019,http://fixthephoto.com/academic-scholarship
BusinessPlan Scholarships,Bachelor,1 November 2019,https://www.businessplan.com.ng/scholarships/
Internet Marketing Scholarship - 3rd IBG Scholarship 2019,Bachelor,30 November 2019,https://instaboostgram.com/scholarship/
"The $2,000 ""Privacy Matters"" College Scholarship","Master, Bachelor, Phd, Course",30 April 2019,https://www.bestvpn.com/scholarship/
Durham University Business School - Online MBA Scholarship,Master,28 February 2019,https://www.dur.ac.uk/business/programmes/mba/scholarships/
Scholarship Grant for Undergradute Students,Bachelor,14 December 2019,https://5beddings.com/scholarship-grant-for-undergraduate-students/
International Scholarship for Research on Primary Snoring,"Bachelor, Master, Phd, Course",31 July 2019,
Adzuna’s Student of the Year Award 2018,"Bachelor, Master",31 December 2018,
Cambridge Immerse Scholarship Programme,Course,7 December 2018,
International College of Liberal Arts Scholarship Opportunity,Bachelor,20 April 2018,https://docs.google.com/forms/d/e/1FAIpQLSdQlfQsFGh4PvnLWctleq3Q5p_LllXSrUMzC618xcWm-CKdKg/viewform
BOLC Distance Learning Scholarships,Course,31 December 2017,
Community Service Scholarship,Bachelor,31 October 2018,https://www.greenmatch.co.uk/scholarship
EDOOFA SCHOLARSHIP PROGRAM,"Bachelor, Master, Phd, Course",31 May 2018,http://edoofa.com/
Civil Society Leader Award 2018,"Bachelor, Phd, Course",12 December 2019,https://usschoarships.blogspot.com/2018/04/civil-society-leader-award-2018.html
Scholarships for Hispanics 2018-2019,"Bachelor, Master, Phd, Course",9 September 2019,http://scholarmintle.com/3-best-scholarships-for-hispanics-2018-2019/
Scholarships in the USA Fully Funded 2018-2019,"Bachelor, Phd, Course",6 June 2019,http://scholarmintle.com/scholarships-in-usa-fully-funded/
Scholarships and Grants for National and International students,"Bachelor, Master, Phd, Course",7 June 2019,http://scholarmintle.com/scholarships-grants-national-international-students/
Scholarships For African Students,"Bachelor, Master, Phd, Course",9 August 2019,http://scholarmintle.com/african-scholarships-2018-apply-now/
Scholarships For Black Women Apply Right Now,"Bachelor, Master, Phd, Course",9 August 2019,http://scholarmintle.com/scholarships-for-black-women/
Scholarships for Women 2018-2019,"Bachelor, Master, Phd, Course",9 October 2019,http://scholarmintle.com/scholarships-for-women/
Coupons Accept “Bright Future” Scholarship,Bachelor,31 December 2019,https://couponsaccept.com/coupons-accept-bright-future-scholarship/
Saudi Arabia Scholarships 2018 Best For International Students ,"Bachelor, Master, Phd, Course",9 May 2019,http://scholarmintle.com/saudi-arabia-scholarship-international-students/
"Scholarships Canada Fully Funded List, Grants and Fellowships","Bachelor, Master, Phd, Course",9 August 2019,http://scholarmintle.com/scholarships-canada/
FUlly Funded Scholarships In United States,"Bachelor, Master, Phd, Course",7 September 2019,
Atlas Shrugged Essay Contest,Course,15 January 2019,https://www.aynrand.org/students/essay-contests#atlasshrugged-1
How E-Commerce Will Look Like in 2030 – Trends and Ideas,"Bachelor, Master, Phd, Course",28 February 2019,https://homus.org/scholarship-2019/
CBD Sense Scholarship,"Bachelor, Master, Phd, Course",1 February 2019,https://www.cbdsense.com/scholarship/
Research/PHD Scholarships For Talented Students,"Bachelor, Master, Phd, Course",4 March 2019,http://scholarmintle.com/phd-programs-2018-2019/
Scholarships For International students in Canada,"Bachelor, Master, Phd, Course",9 September 2019,http://scholarmintle.com/scholarships-international-student-canada/
Scholarships for American Students 2018-2019,"Bachelor, Master, Phd, Course",2 October 2019,http://scholarmintle.com/scholarships-american-students/
$1000 Autumn Scholarship Contest from Homework Lab,"Bachelor, Master, Phd, Course",23 November 2018,https://homework-lab.com/study-tips/homework-lab-scholarship/
Scholarships in Nigeria Fully Funded 2019 ,"Bachelor, Master, Phd, Course",9 September 2019,http://scholarmintle.com/scholarships-in-nigeria-2018-2019-fully-funded/
Rotary District 5450 Scholarship,"Master, Phd",1 October 2018,https://portal.clubrunner.ca/50085/sitepage/scholarship-program
RetouchThePhotos Academic Scholarship 2018 Program,"Bachelor, Master, Course",31 December 2018,
THE ABC DISCOVERS DIGITAL TALENT COMPETITION 2018-2019,"Bachelor, Master, Phd, Course",10 October 2019,http://scholarmintle.com/abc-digital-talent-competition/
USAID Scholarships For Pakistani Students ,"Bachelor, Phd, Course",9 September 2019,http://scholarmintle.com/how-to-get-usaid-scholarship-pakistan/
Study in America As International Student with these Free Loan based Application Programs,"Bachelor, Master, Phd, Course",5 May 2019,http://scholarmintle.com/private-student-loans/
Scholarships in China Fully Funded For Engineering and Medicine Studies,"Bachelor, Master, Phd, Course",6 June 2019,http://scholarmintle.com/scholarships-china-fully-funded-engineering-medicine-studies/
SeniorAdvice.com Senior Caregiver Scholarship,"Bachelor, Master, Phd",15 January 2019,https://www.senioradvice.com/senior-caregiver-scholarship-spring-2019
Scholarships for Eritrea in France 2018-2019 Fully Funded,"Bachelor, Master, Phd, Course",3 June 2019,http://scholarmintle.com/study-france-scholarships/
BlogMean $1000 Scholarship for All Students,"Bachelor, Master, Phd, Course",31 May 2019,https://www.blogmean.org/scholarship/
Perkins loan 2018 Federal Loans for College students,"Bachelor, Master, Phd, Course",9 September 2019,http://scholarmintle.com/perkins-loans-2018/
The Travel Office Local Adventures Travel Scholarship,Bachelor,15 October 2018,https://traveloffice.org/scholarship/
Scholarships For Indian Students Fully Funded College Education,"Master, Phd, Course",7 June 2019,http://scholarmintle.com/scholarships-china-fully-funded-engineering-medicine-studies/
Scholarships in France Fully Funded 2018-2019 For International Students ,"Bachelor, Master, Phd, Course",4 June 2019,http://scholarmintle.com/study-france-scholarships/
WISDOM Educational Foundation Scholarship 2019,Course,15 November 2018,https://www.buddy4study.com/scholarship/wisdom-educational-foundation-scholarship-2019?utm_source=SP27Aug&utm_medium=Scholarshiplisting&utm_campaign=Kshitiza
undergraduate scholarships in Nigeria 2018,"Bachelor, Master, Phd, Course",9 August 2019,http://scholarmintle.com/scholarships-in-nigeria-2018-2019-fully-funded/
Fully Funded Scholarships For European Countries,"Bachelor, Master, Phd, Course",8 September 2019,http://scholarmintle.com/scholarships-grants-national-international-students/
DAAD Scholarships for National And International Students,"Bachelor, Master, Phd, Course",10 October 2019,http://scholarmintle.com/daad-scholarships-international-students/
Private Students Loans For College with Repayment period of more then 15 Years,"Bachelor, Master, Phd, Course",6 June 2019,http://scholarmintle.com/private-student-loans/
Fully Funded Scholarships in Nigeria 2018-2019,"Bachelor, Master, Phd, Course",9 September 2019,http://scholarmintle.com/full-list-of-scholarships/
DAAD Scholarships For Studying In Germany,"Bachelor, Master, Phd, Course",2 January 2020,http://scholarmintle.com/daad-scholarships-international-students/
Single mothers Scholarships 2018-2019 Fully Funded In United States and Other Inational Countries,"Bachelor, Master, Phd, Course",2 May 2019,http://scholarmintle.com/single-parent-grant-mothers-2018/
Best Career Path Scholarship (Medical),"Bachelor, Master, Phd",15 September 2018,https://bestrateddocs.com/scholarships/
DBT (Govt.of India) sponsored PG Diploma Course on Skill Development in Fishery Food Products Technology,Course,31 August 2018,
Undergraduate Scholarship Program,Bachelor,6 April 2019,
scholarships in Nigeria 2018-2019,"Bachelor, Master, Phd, Course",4 April 2019,http://scholarmintle.com/scholarships-in-nigeria-2018-2019-fully-funded/
Scholarships for Women that you Must Avail,"Bachelor, Master, Phd, Course",8 July 2019,http://scholarmintle.com/scholarships-for-women/
Scholarships portal New Scholarships listed 2018-2019 ,"Bachelor, Master, Course",5 May 2019,http://scholarmintle.com/scholarships-grants-national-international-students/
Scholarshipportal.com Scholarships Listed 2018-2019,"Bachelor, Master, Phd, Course",29 October 2019,
BestVPN.co Scholarship Program,"Bachelor, Master",30 September 2018,
Scholarships for Women 2018-2019,"Bachelor, Master, Phd, Course",6 May 2019,
"Swami Vivekananda Merit Cum Means Scholarship for Minorities, West Bengal 2018","Bachelor, Master, Phd, Course",30 September 2018,https://www.buddy4study.com/scholarship/swami-vivekananda-merit-cum-means-scholarship-for-minorities-west-bengal-2018
Scholarships In USA 2018 Fully Funded,"Bachelor, Master, Phd, Course",1 May 2019,http://scholarmintle.com/scholarships-in-usa-fully-funded/
"Scholarships Canada Fully Funded List, Grants and Fellowships","Bachelor, Master, Phd, Course",1 May 2019,http://scholarmintle.com/scholarships-canada/
College Scholarships for International Students,"Bachelor, Master, Phd, Course",6 June 2019,http://scholarmintle.com/college-scholarships-fully-funded/
Research Scholarships 2018-2019 Fully Funded ,"Bachelor, Master, Phd, Course",2 May 2019,http://scholarmintle.com/phd-programs-2018-2019/
Scholarships in China for Medical and Engineering studies 2018-2019,"Bachelor, Master, Phd, Course",7 July 2019,http://scholarmintle.com/scholarships-china-fully-funded-engineering-medicine-studies/
MBBS in Ukraine Scholarships Study in Ukraine 2018-2019,"Bachelor, Master, Phd, Course",6 June 2019,http://scholarmintle.com/mbbs-in-ukraine-scholarships/
Full Funded Academic Scholarships In Germany 2018-2019,"Bachelor, Master, Phd, Course",1 January 2019,http://scholarmintle.com/full-funded-academic-scholarships-in-germany-2018-2019/
Scholarships In Australia 2018-2019 Fully Funded For International Students,"Bachelor, Master, Phd",6 June 2019,http://scholarmintle.com/scholarships-in-australia/
George Washington University Global Leaders Fellowship Program 2018-2019,"Bachelor, Master, Phd, Course",8 February 2019,http://scholarmintle.com/george-washington-university-global-leaders-fellowship-program-2018-2019/
"UnderRecruited Preps $2,000 Student-Athlete Scholarship",Bachelor,,
best rain barrel,Course,9 February 2020,https://www.techlistify.com/
TechMintle Article Writing Scholarships ,"Bachelor, Master, Phd, Course",20 September 2018,http://techmintle.com
EDOOFA SCHOLARSHIP PROGRAM,"Bachelor, Master, Phd, Course",31 December 2019,
April 2019 -Scholarship Application Open! Faculty of Global Studies,Bachelor,,http://w-square.com/english/information/mu2019/
Biological Sciences: Fully Funded KESS II MRes Scholarship at Swansea University: Supporting a green economy: Assessing anti-oxidising properties and bioactive compounds in macroalgae,"Bachelor, Master, Phd, Course",1 August 2018,https://usschoarships.blogspot.com/2018/04/civil-society-leader-award-2018.html
PREPLY 2018 Essay Competition,"Bachelor, Master, Phd, Course",15 August 2018,https://usschoarships.blogspot.com/2018/04/civil-society-leader-award-2018.html
GeneTex for Education,"Bachelor, Master, Phd",31 August 2018,http://www.genetex.com/scholarship
LPG Young Talent Grants,"Bachelor, Master, Phd",25 October 2018,
Full Academic Scholarships - Germany,Course,1 January 2019,
L'Oréal India For Young Women in Science Scholarship 2018,Course,17 July 2018,https://bit.ly/2MwC6J3
Thesis Award in European Studies,"Master, Phd, Course",30 June 2018,http://ces.epoka.edu.al/event-thesis-award-in-european-studies-4115.html
Free 10 Accredted Data Safety (GDPR) Courses,"Bachelor, Master, Phd, Course",15 June 2019,
Sir Robert Black Trust Fund for Undergraduate/Postgraduate Students:,"Bachelor, Master",31 July 2018,
Win the FELU MBA Scholarship and boost your professional growth!,Master,30 September 2018,
$2000 Coupons Promos Scholarship,"Bachelor, Master, Phd, Course",31 July 2019,
https://homework-lab.com/study-tips/homework-lab-scholarship/,"Bachelor, Master, Phd",20 August 2018,https://homework-lab.com/study-tips/homework-lab-scholarship/
$1000 Scholarship Contest from Homework Lab,"Bachelor, Master, Phd",20 August 2018,https://homework-lab.com/study-tips/homework-lab-scholarship/
Data Science and Analytics @ Thai Nichi offers scholarships,Bachelor,16 July 2018,http://inter.tni.ac.th/page/DATA-SCIENCE-AND-ANALYTICS
Scholarship for Interior Design students,"Bachelor, Master, Phd, Course",10 February 2019,http://www.homedecorbuzz.com/scholarship/
Thomas More Scholarship,Bachelor,22 June 2018,http://www.minicklaw.com/thomas-more-scholarship/
Cusabio Scholarship 2018,"Bachelor, Master",18 September 2018,https://www.cusabio.com/scholarship.html
PREPLY 2018 Essay Competition,Course,29 June 2018,https://preply.com/en/scholarships
Eduloan By Buddy4study,"Bachelor, Master, Phd, Course",31 December 2018,https://bit.ly/2ssyyAc
PCTE Group of Institutes,"Bachelor, Master",25 June 2018,http://pcte.edu.in/
iVisa Annual Scholarship,"Bachelor, Master, Phd, Course",15 May 2019,https://www.ivisa.com/visa-blog/ivisa-annual-scholarship
Benjamin Bloom Scholarship Program,"Bachelor, Master, Phd",30 December 2018,https://assignmentessayhelp.com/benjaminbloom_scholarships/
2018 REACHIVY SCHOLARSHIP,"Bachelor, Master",30 June 2018,https://www.reachivy.com/2018-reachivy-scholarship.html
Courage to Grow Scholarship,"Bachelor, Master, Phd, Course",31 May 2018,
